,NODE,LTEXT,LTEXT_T
0,BG,ม่านตาไก่,Pierced
1,BH,ม่านหลุยส์,Louise
2,BI,ม่านคอกระเช้า,Loop
3,BJ,มู่ลี่ไม้,Wooden Blind
4,BK,มู่ลี่อลูมิเนียม,Venetian Blind
5,BL,ม่านพับ,Roman Blind
6,BM,ม่านม้วน,Roller Blind
7,BN,แผ่นไม้ปูพื้นสนาม,Decking
8,BO,กล่องเก็บเงิน,Cash Box
9,BP,เตาอบ,Oven
10,BQ,ตู้เย็น,Refrigerator
11,BS,เครื่องล้างจาน,Dishwasher
12,BT,เครื่องซักผ้า,Washing Machine
13,BU,ตู้แช่ไวน์,Wine Cabinet
14,DM,3D Wall,3D Wall
15,CH,ซีรีย์ตู้ผ้าBuilt-In,Built-InWardrobe Set
16,CI,พื้นล่าง,Base Panel
17,CW,TV Flip,TV หมุน
18,CX,Porcelain,Porcelain
19,DN,PU 3D Panel,PU 3D Panel
20,01,**Delete**,
21,02,เตียง,
22,03,**Delete**,
23,04,**Delete**,
24,05,เตา,
25,06,**Delete**,
26,07,เครื่องดูดควัน,
27,08,**Delete**,
28,09,อุปกรณ์เสริมสำนักงาน,
29,10,เก้าอี้สนาม,
30,11,**Delete**,
31,12,เฟอร์นิเจอร์สนามอื่นๆ,
32,13,โต๊ะสนาม,
33,14,ที่กั้นห้อง,
34,15,เก้าอี้พักผ่อน 1 ที่นั่ง,
35,16,เก้าอี้พักผ่อน 2 ที่นั่ง,
36,17,เก้าอี้พักผ่อน 3 ที่นั่ง,
37,18,ปิดปลอม,
38,19,**Delete**,
39,20,อ่างล้างจาน,
40,21,ท็อปชุดครัว,
41,22,วอลล์เปเปอร์,
42,23,**Delete**,
43,24,สติ๊กเกอร์ติดผนัง,
44,25,เก้าอี้สั่งทำ,
45,26,เก้าอี้เหล็กเบาะไม้,
46,27,เก้าอี้เหล็กเบาะผ้า,
47,28,เก้าอี้เหล็กเบาะพลาสติก,
48,29,เก้าอี้เหล็กเบาะหนัง,
49,30,เก้าอี้เหล็กล้วน,
50,31,เก้าอี้ไฟเบอร์กลาส/พลาสติก,Dining Chair/Fiber/Plastic
51,32,เก้าอี้ไม้เบาะผ้า,
52,33,เก้าอี้ไม้เบาะหนัง,
53,34,เก้าอี้ไม้ล้วน,
54,35,เก้าอี้สตูลบาร์เหล็กเบาะไม้,
55,36,เก้าอี้สตูลบาร์เหล็กเบาะผ้า,
56,37,เก้าอี้สตูลบาร์เหล็กเบาะหนัง,
57,38,เก้าอี้สตูลบาร์เหล็กล้วน,
58,39,เก้าอี้สตูลบาร์ไม้เบาะผ้า,
59,40,เก้าอี้สตูลบาร์ไม้เบาะหนัง,
60,41,เก้าอี้สตูลบาร์ไม้ล้วน,
61,42,เก้าอี้สำนักงาน,
62,43,เครื่องแก้วตกแต่ง,
63,44,เคาน์เตอร์ครัว,
64,45,เคาน์เตอร์บาร์,
65,46,เชิงเทียน,
66,47,เดย์เบด,
67,48,เทียน,
68,49,เบาะรองนั่ง,
69,50,แจกัน,
70,51,โคมไฟแขวน,
71,52,โคมไฟตั้งโต๊ะ,
72,53,โคมไฟตั้งพื้น,
73,54,โคมไฟติดเพดาน,
74,55,โคมไฟติดผนัง,
75,56,**Delete**,**Delete**
76,57,โซฟา 1 ที่นั่ง,
77,58,โซฟา 2 ที่นั่ง,
78,59,โซฟา 3 ที่นั่ง,
79,60,โซฟา 4 ที่นั่ง,
80,61,โซฟาสั่งทำ,
81,62,โซฟาเข้ามุมขวา,
82,63,โซฟาเข้ามุมขวาปรับระดับได้,
83,64,โซฟาเข้ามุมซ้าย,
84,65,โซฟาเข้ามุมซ้ายปรับระดับได้,
85,66,โซฟาเข้ามุมสลับซ้าย/ขวามีCorner,
86,67,โซฟาเข้ามุมสลับด้านได้ซ้าย/ขวา,
87,68,โซฟาเบด,
88,69,โซฟาเบด 1 ที่นั่ง,
89,70,ตู้ข้างเตียง,
90,71,โต๊ะเครื่องแป้งแบบนั่ง,
91,72,โต๊ะเครื่องแป้งแบบยืน,
92,73,โต๊ะกลางเหล็กท๊อปไม้,
93,74,โต๊ะกลางเหล็กท๊อปกระจก,
94,75,โต๊ะกลางเหล็กท๊อปหิน,
95,76,โต๊ะกลางเหล็กล้วน,
96,77,โต๊ะกลางไม้ท๊อปกระจก,
97,78,โต๊ะกลางไม้ท๊อปหิน,
98,79,โต๊ะกลางไม้ล้วน,
99,80,โต๊ะกลางกระจกล้วน,
100,81,โต๊ะกลางหนัง,
101,82,โต๊ะกลางหินล้วน,
102,83,โต๊ะข้างเหล็กท๊อปไม้,
103,84,โต๊ะข้างเหล็กท๊อปกระจก,
104,85,โต๊ะข้างเหล็กท๊อปหิน,
105,86,โต๊ะข้างเหล็กล้วน,
106,87,โต๊ะข้างไฟเบอร์กลาส,
107,88,โต๊ะข้างไม้ท๊อปกระจก,
108,89,โต๊ะข้างไม้ท๊อปหิน,
109,90,โต๊ะข้างไม้ล้วน,
110,91,โต๊ะข้างกระจกล้วน,
111,92,โต๊ะข้างหนัง,
112,93,โต๊ะข้างหินล้วน,
113,94,โต๊ะคอมพิวเตอร์,
114,95,โต๊ะทำงาน,
115,96,โต๊ะบาร์เหล็กล้วน,
116,97,โต๊ะบาร์ขาเหล็กท๊อปเหล็ก,
117,98,โต๊ะบาร์ขาเหล็กท๊อปไม้,
118,99,โต๊ะอาหารสั่งทำ,
119,A0,โต๊ะอาหารเหล็กล้วน,
120,A1,โต๊ะอาหารไฟเบอร์กลาส/พลาสติก,Dining Table/Fiber/Plastic
121,A2,โต๊ะอาหารไม้ล้วน,Dining Table/Wood
122,A3,โต๊ะอาหารกระจกล้วน,
123,A4,โต๊ะอาหารขาเหล็กท๊อปไม้,
124,A5,โต๊ะอาหารขาเหล็กท๊อปกระจก,Dining Table/Steel/Glass Top
125,A6,โต๊ะอาหารขาเหล็กท๊อปหิน,Dining Table/Steel/Natural Stone Top
126,A7,โต๊ะอาหารขาไม้ท๊อปกระจก,Dining Table/Wood/Glass Top
127,A8,โต๊ะอาหารขาไม้ท๊อปหิน,Dining Table/Wood/Natural Stone Top
128,A9,โต๊ะอาหารขาหินท๊อปกระจก,
129,AA,อุปกรณ์สำหรับเด็ก,
130,AB,อุปกรณ์อาบน้ำ,
131,AC,อุปกรณ์อื่นๆ,
132,AD,โคมไฟแชงเดอร์เรีย,
133,AE,**Delete**,
134,AF,**Delete**,
135,AG,กล่องใส่กุญแจ,
136,AH,ที่แขวนเครื่องประดับ,
137,AI,กล่องทิชชู่,
138,AJ,ดอกไม้ปลอม,
139,AK,ต้นไม้ปลอม,
140,AL,รั้ว,
141,AM,หญ้าเทียม,
142,AN,อุปกรณ์ตัดแต่งต้นไม้และดูแลสวน,
143,AO,สปาและอุปกรณ์,
144,AP,ที่ทับกระดาษ,
145,AQ,สติ๊กเกอร์ติดผนัง,
146,AR,ชุดเครื่องนอนเด็ก,
147,AS,เตียงสั่งทำ,
148,AT,ชุดวางทีวีและตู้เก็บของสั่งทำ,
149,AU,อาร์มแชร์ผ้า,
150,AV,**Delete**,
151,AW,อาร์มแชร์หนังแท้ทั้งตัว,
152,AX,อาร์มแชร์หนังสังเคราะห์,
153,AY,อาร์มแชร์ไม้,
154,AZ,อาร์มแชร์เหล็ก,
155,B0,โต๊ะอาหารหินล้วน,Dining Table/Natural Stone Top
156,B1,ไซด์บอร์ด,
157,B2,ไม้รองท็อป,
158,B3,ไส้หมอนอิง,
159,B4,กรอบรูป,
160,B5,กระจกแบบแขวน,
161,B6,กระจกแบบตั้งโต๊ะ,
162,B7,กระจกแบบตั้งพื้น,
163,B8,กระจกแบบติดผนัง,
164,B9,**Delete**,
165,BA,**Delete**,
166,BB,หินควอทซ์,
167,BC,หินสังเคราะห์,
168,BD,หินแกรนิต,
169,C0,**Delete**,
170,C1,**Delete**,
171,C2,กล่องแขวน,Hanging Box
172,C3,กล่องใส่นิตยสาร,
173,C4,กล่องอเนกประสงค์,
174,C5,ของใช้บนโต๊ะอาหาร,
175,C6,คอนโซล,
176,C7,ชั้นแขวน,
177,C8,ชั้นวางคีย์บอร์ด,
178,C9,ชั้นวางซีดี/หนังสือ,
179,D0,**Delete**,
180,D1,Stainless Kitchen,
181,D2,ตู้เตี้ยบานเปิด,
182,D3,ตู้เตี้ยลิ้นชัก,
183,D4,ตู้เสื้อผ้าบานเปิด,
184,D5,ตู้เสื้อผ้าบานเฟี้ยม,
185,D6,ตู้เสื้อผ้าบานเลื่อน,
186,D7,ตู้แขวน,
187,D8,ตู้แขวนทีวี,
188,D9,ตู้โชว์,
189,E0,ตู้โชว์+วางทีวี,
190,E1,ตู้กั้นห้อง/ชั้นกั้นห้อง,
191,E2,ตู้รองเท้า,
192,E3,ตู้ลิ้นชักล้อเลื่อน,
193,E4,ตู้สูง,
194,E5,ถาดใส่เอกสาร,
195,E6,ที่นอนสั่งทำ,
196,E7,ที่นอนเมมโมรี่โฟม,
197,E8,ที่นอนพ็อคเกตสปริง,
198,E9,ที่นอนยางพารา,
199,F0,ที่นอนวิสโคอีลาสติก,
200,F1,ที่นอนสปริง,
201,F2,นาฬิกาแขวนผนัง,
202,F3,นาฬิกาตั้งโต๊ะ,
203,F4,บอดี้ + หน้าบานชุดครัว,
204,F5,บอดี้ชุดครัว,
205,F6,บอดี้ตู้,
206,F7,ปลอกหมอนอิง,
207,F8,ผนังตกแต่งไม้,
208,F9,ผนังตกแต่งกล่องเก็บของ,
209,G0,ผนังตกแต่งผ้า,
210,G1,ผนังตกแต่งหนัง,
211,G2,ผ้าปูโต๊ะ,
212,G3,ผ้าม่านสั่งทำ,
213,G4,ผ้าม่านสำเร็จรูป,
214,G5,ผ้าหุ้มโซฟา,
215,G6,**Delete**,
216,G7,พรมห้องน้ำ,
217,G8,**Delete**,**Delete**
218,G9,มือจับ,
219,H0,สตูล,
220,H1,สตูลสั่งทำ,
221,H2,สตูล โซฟา,
222,H3,หน้าบาน,
223,H4,หน้าบานชุดครัว,
224,H5,หน้าบานตู้เสื้อผ้าบานเปิด,
225,H6,หน้าบานตู้เสื้อผ้าบานเลื่อน,
226,H7,หน้าบานประตู,
227,H8,หมอนสั่งทำ,
228,H9,**Delete**,
229,I0,หมอนหนุนเมมโมรี่โฟม,
230,I1,หมอนหนุนยางพารา,
231,I2,หมอนหนุนวิสโคอีลาสติก,
232,I3,หมอนอิง,
233,I4,อุปกรณ์ผ้าม่าน,
234,I5,ตู้เสื้อผ้าเข้ามุมบานเปิด,
235,I6,**Delete**,
236,I7,หน้าลิ้นชัก,
237,I8,โซฟาสนาม,
238,I9,**Delete**,
239,J0,ราวแขวน,
240,J1,พื้นบนตู้ลิ้นชัก,
241,J2,กล่องบานยก,
242,J3,กล่องลิ้นชัก,
243,J4,กล่องโล่ง,
244,J5,ชั้นโล่ง,
245,J6,โต๊ะเขียนหนังสือ,Writing Desk
246,J7,เซรามิคตกแต่ง,
247,J8,ของตกแต่งอื่น ๆ,
248,J9,ของตกแต่งเหล็กดัด,
249,K1,ตะเกียง,
250,K2,ชุดปลั๊กไฟ,
251,K3,หนังสือปลอม,
252,K4,สินค้าเบ็ดเตล็ด,
253,K5,แผ่นเข้ามุม,
254,K6,นาฬิกาตั้งพื้น,
255,K7,ตู้เสื้อผ้าอินโนเวชั่น,
256,K8,ภาพแขวน,
257,K9,กล่องใส่เครื่องประดับ,
258,L1,โถเซรามิค/โถหิน,
259,L2,ของใช้ในห้องน้ำ,
260,L3,กล่องใส่นามบัตร,
261,L4,อุปกรณ์ผ้าใช้ในครัวและบนโต๊ะอาหาร,
262,L5,ที่คั่นหนังสือ,
263,L6,Topโต๊ะ,
264,L7,ขาโต๊ะ,
265,L8,ตู้เตี้ย,
266,L9,เก้าอี้พักผ่อนเข้ามุม,
267,M1,โต๊ะหมู่บูชา,
268,M2,กระถางต้นไม้,
269,M3,**Delete**,
270,M4,ตะขอติดผนัง,
271,M5,หุ่นจำลอง,
272,M6,สมุดโน๊ต/อัลบั้มรูป,
273,M7,เก้าอี้พักผ่อนสั่งทำ,
274,M8,ที่นอนสปริง+ยางพารา,
275,M9,ที่นอนพ็อคเก็ตสปริง+ยางพารา,
276,N1,ที่นอนโฟมสังเคราะห์,
277,N2,ที่นอนฟองน้ำอัด,
278,N3,ที่นอนโฟม,
279,N4,แผ่นรองที่นอน,
280,N5,ชุดผ้าปูที่นอน,
281,N6,ชุดผ้าปูที่นอน+ผ้านวม,
282,N7,ปลอกหมอน,
283,N8,ผ้านวมเย็บติด,
284,N9,ปลอกผ้านวม,
285,O1,ไส้ผ้านวม,
286,O2,ผ้ารองกันเปื้อน,
287,O3,หมอนหนุน,
288,O4,หมอนข้าง,
289,O5,เตียงไฟฟ้า,
290,O6,ชิงช้า,
291,O7,อุปกรณ์เสริมชุดครัว,
292,O8,**Delete**,
293,O9,TV ชั้นแขวน IHTV,
294,P1,TV ตู้แขวนแบบกรอบ IHBTV,
295,P2,TV ตู้แขวนลิ้นชักลึก30 IHDW,
296,P3,TV ตู้แขวนลิ้นชักลึก45 IHDW,
297,P4,TV ตู้พื้น IB,
298,P5,TV โต๊ะ ITVB,
299,P6,กล่องแขวน โล่งไม้ IHB,
300,P7,กล่องแขวน โล่งไม้ IWB,
301,P8,กล่องแขวน โล่งไม้แนวตั้ง IWB,
302,P9,กล่องแขวน โล่งเหล็ก ISB,
303,Q1,ชั้นแขวน มีผนังกระจก ISM,
304,Q2,ชั้นแขวน มีผนังไม้ IS,
305,Q3,ชั้นแขวน ลอย IFS,
306,Q4,ตู้แขวน ชั้นกระจก 60 IHBG,
307,Q5,ตู้แขวน ชั้นไม้ 60 IHBW,
308,Q6,ตู้แขวน แนวตั้ง IHBV,
309,Q7,ตู้แขวน แนวนอนลึก 30 IHBH,
310,Q8,ตู้แขวน แนวนอนลึก 35 IHBH,
311,Q9,ตู้พื้น ลิ้นชัก ITVB,
312,R1,โต๊ะทำงาน IHD,
313,R2,เปาคา IDWB,
314,R3,ผนังหลัง กระจก IWM,
315,R4,ผนังหลัง ซ่อนสายไฟ IWE,
316,R5,ผนังหลัง ไม้ IW,
317,R6,พื้นล่าง IBPN,
318,R7,หน้าโต๊ะ ตู้พื้น IT-B,
319,R8,หน้าโต๊ะ ตู้ลิ้นชักลึก30 IT,
320,R9,หน้าโต๊ะ ตู้ลิ้นชักลึก45 IT,
321,S1,หน้าบาน 60,
322,S2,หน้าบาน ตู้แขวนแนวตั้ง,
323,S3,หน้าบาน ตู้แขวนแนวนอน Flap down,
324,S4,หน้าบาน ตู้แขวนแนวนอน Flap up,
325,S5,หน้าลิ้นชัก ตู้TVโต๊ะ DW-TVB,
326,S6,หน้าลิ้นชัก ตู้แขวน 60 DW-60,
327,S7,หน้าลิ้นชัก ตู้แขวน DW,
328,S8,หน้าลิ้นชัก ตู้พื้น DW-B,
329,S9,ตู้แขวน ลิ้นชัก IHDW 60,
330,T1,กล่องแขวน โล่งไม้ IHB ลึก 15,
331,T2,กล่องแขวน โล่งไม้ IHB ลึก 30,
332,T3,ผนังหลัง ไม้ IW 15,
333,T4,ผนังหลัง ไม้ IW 30,
334,T5,ผนังหลัง ไม้ IW 60,
335,T6,ตู้โชว์ ISC,
336,T7,สายไฟ,
337,T8,ชุดครัวสแตนเลส,
338,T9,กริ่งสนทนาเห็นภาพและเสียง,
339,U1,กล้องตาแมว,
340,U2,กลอนประตูดิจิตอล,
341,U3,เก้าอี้นวดไฟฟ้า,
342,U4,ตู้เซฟ,
343,U5,โฮมเธียเตอร์,
344,U6,เครื่องสั่น,
345,U7,เบาะนวด,
346,U8,เครื่องนวดเท้า,
347,U9,เครื่องนวดคอ,
348,V1,หมอนนวด,
349,V2,Top หิน,
350,V3,Top ไม้,
351,V4,Gadgets,
352,V5,กระเป๋า,
353,V6,ถังขยะ,
354,V7,กล่องและภาชนะเก็บอาหาร,
355,V8,การ์ด,
356,V9,ขวดเครื่องปรุง,
357,W0,ของขวัญ กิ๊ฟช็อป,
358,W1,ของขวัญสำหรับเด็ก,
359,W2,ของตกแต่งห้องเด็ก,
360,W3,ของเล่นเด็ก,
361,W4,เครื่องแก้วและเหยือกน้ำ,
362,W5,เครื่องเขียน,
363,W6,เครื่องใช้ในครัว,
364,W7,โคมไฟสำหรับเด็ก,
365,W8,ช้อนส้อมมีด,
366,W9,**Delete**,
367,X0,ชาและกาแฟ,
368,X1,โซฟาสำหรับเด็ก,
369,X2,ตะกร้า,
370,X3,ตำราอาหาร,
371,X4,ผ้าคลุมเตียง,
372,X5,โป๊ะโคมไฟ,
373,X6,ผ้าขนหนู,
374,X7,ผ้าคาดเตียง,
375,X8,ผ้าเช็ดปาก,
376,X9,ผ้าสำหรับเด็ก,
377,Y0,พรมเช็ดเท้า,
378,Y1,พรมตกแต่ง,
379,Y2,เฟอร์นิเจอร์เด็ก,
380,Y3,เฟอร์นิเจอร์และที่เก็บของในห้องน้ำ,
381,Y4,แฟ้มแขวน,
382,Y5,ถาดและรถเข็น,
383,Y6,ภาชนะใส่อาหาร,
384,Y7,ม่านห้องน้ำ,
385,Y8,มีดทำครัว,
386,Y9,ร่ม,
387,Z0,ลำโพงบลูทูธ,
388,Z1,สินค้าสำหรับเด็กอื่นๆ,
389,Z2,หนังสือ,
390,Z3,หลอดไฟและอุปกรณ์,
391,Z4,อุปกรณ์ทำขนม,
392,Z5,อุปกรณ์ทำอาหาร,
393,Z6,อุปกรณ์ในห้องน้ำ,
394,Z7,อุปกรณ์บนโต๊ะทำงาน,
395,Z8,อุปกรณ์บาร์,
396,Z9,อุปกรณ์พิเศษ,
397,BF,ม่านจีบ,Pleated
398,MG,เฟอร์นิเจอร์เป่าลม,Air Furniture
399,CG,อาร์มแชร์หนังนาโน,Armchair/Nano
400,CK,ชุดครัว Divani,Kitchen Set Divani
401,CL,ชุดครัว Domino,Kitchen Set Domino
402,CM,ชุดครัว Kourmet,Kitchen Set Kourmet
403,CN,Gate Door,ระบบประตูรั้วอัตโนมัติ
404,CO,Window Automation,ระบบมอเตอร์สำหรับม่าน
405,CP,Vertical Awning,กันสาด แนวตั้ง
406,CQ,Horizontal Awning,กันสาด แนวนอน
407,CR,Arch Unit,โครงซุ้มทีวี
408,CS,Bed Head,โครงซุ้มหัวเตียง
409,CT,Body structure,โครงตู้
410,CU,Door's Fitting,อุปกรณ์เสริมหน้าบาน
411,CV,TV Unit,โครงตู้ทีวี
412,CY,Vacuum Cleaner,เครื่องดูดฝุ่น
413,DF,ที่นอนพ็อคเกตสปริง+เมมโมรี่โฟม,Mattress Pocket Spring + Memory Foam
414,DH,ที่นอนโฟมสังเคราะห์+ยางพารา,Mattress Synthetic Foam + Latex
415,DI,โต๊ะกลางไม้ท๊อปเหล็ก,Coffee Table/Wood/Steel Top
416,DJ,ชุดครัว Croissant,Kitchen Set Croissant
417,DB,ผนังตกแต่งกระจก,Mirror decorative wall
418,BE,อาร์มแชร์หวาย,Armchair/Rattan
419,BW,ชุดครัว Kuche,Kitchen Set Kuche
420,BX,ชุดตู้เก็บของหนังสือ,Storage Set
421,BY,ชุดผนังตกแต่ง,Wall Storage Set
422,BZ,ชุดวางทีวี Infinity,Infinity TV Set
423,CA,ชุดวางทีวี Scenario,Scenario TV Set
424,CB,ซีรีย์ตู้ผ้า WD Plus,Wardrobe Plus Set
425,CC,ซีรีย์ตู้ผ้า Maxio,Maxio Wardrobe Set
426,CD,ชุดห้องนอน,Bedroom Set
427,CE,ชุดห้องนอนเด็ก,Kids Bedroom Set
428,CF,ชุดวางทีวีสำเร็จรูป,TV Set
429,CJ,ผนังหลัง,Wall panel
430,DC,เก้าอี้สตูลบาร์เบาะพลาสติก,Bar Stool/Plas
431,DK,ที่นอนโฟมออร์แกนิค+ยางพารา,FoamOrganic+Latex Mattress
432,DL,ที่นอนโฟม + ยางพารา,Foam+Latex Mattress
433,DG,ที่นอนสปริง+โฟมสังเคราะห์,Mattress Spring + Synthetic Foam
434,DA,ฟิลม์อาคาร,Building Film
435,DE,ที่นอนพ็อคเกตสปริง+โฟมสังเคราะห์,Mattress Pocket Spring + Synthetic Foam
